,Author Name,Author,Content
8,Бианки,1," ﻿СКАЗКИ ЗВЕРОЛОВА






 ЛЮЛЯ


— Прежде земли вовсе не было, — рассказывает хант-зверолов. — Только одно море было. Звери и птицы жили на воде и детей выводили на воде. И это было очень неудобно. Вот раз собрались звери и птицы со всех концов моря, устроили общее собрание. Председателем выбрали большого-большого Кита. И стали думать, как беде помочь. Долго спорили, шумели, наконец постановили: достать со дна моря щепотку земли и сделать из неё большие острова. И тогда на земле жить, и детей выводить на земле. Хорошо придумали. А как земли достать со дна, — не знают. Море-то ведь глубокое, не донырнёшь до дна. Стали звери и птицы рыб просить:
— Принесите нам, рыбы, щепотку земли со дна,
— А вам зачем? — спрашивают рыбы. — Острова делать. — Нет, — говорят рыбы, — не дадим вам земли острова делать. Нам без островов лучше жить: плыви, куда хочешь. Стали звери и птицы Кита просить:
— Ты из нас самый сильный и большой зверь. Ты председатель наш. Понатужься — нырни на дно. Собрание просит, — нельзя отказываться. Набрал Кит воздуху, ударил хвостом по воде — нырнул. Пошли по морю волны, закачались на них звери и птицы. Ждут-пождут, — нет Кита. Только большие пузыри из воды выскакивают да с треском лопаются. И волны улеглись. Вдруг забурлила вода, всколыхнулось море — выкинуло Кита высоко в воздух. Упал Кит назад в воду, выпустил из ноздрей две струи. — Нет, — говорит, — не достать мне до дна. Очень уж я толстый, не пускает меня вода. Загрустили звери и птицы: уж если Кит не может достать, — кто же достанет? Собрались все в круг, молчат, горюют. Вдруг выплывает в середину круга востроносенькая птица. — Давайте, — говорит, — я попробую. Может быть, я донырну до дна. Посмотрели звери и птицы: да ведь это Люля-Нырец! Ростом с малую уточку. На головке рожки из перьев торчат. Зашумели, рассердились звери и птицы:
— Ты, Люля, смеёшься над нами! Кита-великана море, как щепку, выкинуло. А уж тебя-то, слабенькую, разом расплющит. — А может быть, и ничего, — говорит Люля. — Попробую. И как сидела на воде, так и ушла под воду: только голову опустила — и нет Люли. Даже ряби на волнах не осталось. Ждут-пождут звери и птицы — нет Люли. И море спокойно, только белые пузырики из воды выскакивают и лопаются без шума. Вдруг на том месте, где Люля нырнула, опять она сидит. А когда вынырнула, — никто и не заметил. Сидит, дышит тяжело. Зашумели, засмеялись звери и птицы:
— Где тебе, Люля, до дна достать! Маленькая ты, слабенькая ты, а с Китом тягаться хочешь. А Люля молчит. Отдышалась, отдохнула — опять под воду ушла. Ждут-пождут звери и птицы, смотрят на воду — нет Люли. И море спокойно, только розовые пузырьки из воды выскакивают, лопаются без шума. Вдруг на том месте, где Люля нырнула, опять она сидит. А когда вынырнула, — никто и не заметил. Сидит, тяжело дышит. И глаза у неё розовые стали, и на клюве розовый от крови пузырик. Зашумели звери и птицы: жалко им стало маленькую Люлю. — Довольно, — говорят, — ты для нас постаралась. Отдыхай теперь. Всё равно не достать земли со дна моря. А Люля молчит. Отдышалась, отдохнула — опять под воду ушла. Ждут-пождут звери и птицы, смотрят на воду — нет Люли. И море спокойно. Только красные пузырики из воды выскакивают, лопаются без шума. Зашептали звери и птицы:
— Красные пузырики пошли — это кровь Люлина. Раздавило море Люлю. Не видать нам больше Люли. Вдруг видят: глубоко в воде, под тем местом, где Люля сидела, что-то тёмное мелькает, приближается. Ближе, ближе, — и всплыла наверх Люля ножками кверху. Подхватили её звери и птицы, перевернули, посадили на воду ножками вниз и видят: сидит Люля, еле дышит. Глаза у неё красной кровью налились, на клюве — красный кровяной пузырик, а в клюве — щепотка земли со дна морского. Обрадовались звери и птицы, взяли у Люли щепотку земли и сделали большие острова. А маленькой Люле за то, что землю достала со дна моря, постановили дать награду: пусть в память об этом подвиге навсегда останутся у Люли глаза и клюв красивого красного цвета. На этом собрание и кончилось. И помчались звери, помчались птицы делить между собой землю. А Люля осталась сидеть, где она сидела: она не могла ещё отдышаться. Звери и птицы разобрали всю землю, до последнего клочка. Для Люли-то и не осталось места. Вот и живёт она на воде по-прежнему. Придёт пора детей выводить — соберёт камыш да ветки, что с берега в воду упали, устроит себе плотик плавучий. На нём и выводит детей. Так и плавает всю жизнь по воде. А глаза и клюв у Люли — это верно — и до наших дней красные остались. КУЗЯР-БУРУНДУК И ИНОЙКА-МЕДВЕДЬ


Прежде Кузяр-Бурундук был весь жёлтый, как кедровый орешек без скорлупки. Жил он — никого не боялся, ни от кого не прятался, бегал, где хотел. Да раз ночью поспорил с Инойкой — Медведем. А маленькому с большими — знаешь, как спорить: и выспоришь, да проиграешь. Спор у них был: кто первый утром солнечный луч увидит? Вот взобрались они на пригорышек и сели. Инойка-Медведь сел лицом в ту сторону, где утром из-за леса солнцу вставать. А Кузяр-Бурундук сел лицом туда, где вечером солнце зашло за лес. Спиной к спине сели и сидят — ждут. Перед Кузяром-Бурундуком высокая гора поднимается. Перед Инойкой-Медведем лежит долина гладкая. Инойка-Медведь думает:
«Вот глупый Кузяр! Куда лицом сел! Там до вечера солнца не увидишь». Сидят, молчат, глаз не смыкают. Вот стала ночь светлеть, развиднелось. Перед Инойкой-Медведем долина чёрная лежит, а небо над ней светлеет, светлеет, светлеет…
Инойка и думает:
«Вот сейчас падёт на долину первый лучик, — я и выиграл. Вот сейчас…»
А нет, всё ещё нету лучика. Ждёт Инойка, ждёт…
Вдруг Кузяр-Бурундук за спиной у него как закричит:
— Вижу, я вижу! Я первый! Удивился Инойка-Медведь: перед ним долина всё ещё тёмная. Обернулся через плечо, а позади-то макушки горы так солнцем и горят, так золотом и блещут! И Кузяр-Бурундук на задних лапках пляшет — радуется. Ой, как досадно Инойке-Медведю стало! Проспорил ведь малышу! Протянул тихонько лапу — цоп! — за шиворот Кузяра-Бурун-дука, чтоб не плясал, не дразнился. Да рванулся Кузяр-Бурундук, — так все пять медвежьих когтей и проехали у него по спине."
9,Бианки,1," ﻿ПРЯТКИ






 КОСОЙ САНЬКА


Прятки — или по-нашему, по-новгородски сказать: хоронушки, — игра не одним людям — всему свету известная. Лесом идёшь, — много глаз на тебя глядит, за каждым шагом твоим следят. А ты и не видишь, кто с тобой в прятки играет. Не дале, как прошлой осенью, один случай был у нас в колхозе. Вечером затеяли пятеро наших ребятишек — Ваня, Маня, Таня, Паня и Саня — игру у сенного сарая. Им бы спать пора ложиться: сумерки уж начинаются. Ребятишки-то все мелкие, — долго ли до беды! Как водится у нас, стали в круг, каждый свои два кулачка перед собой выставил. Сосчитались:

 
  — Шла кукушка мимо сети,

  А за нею — злые дети,

  И кричали: Ку-ку! Мяк! Убирай один кулак. На кого «мяк» выпадет, тот один кулачок убирает. Потом по второму разу считаются, по третьему, — пока у последнего один кулачок не останется. Этому, значит, водить. Водить выпало Ване. Ваня взял палочку-выручалочку, стал носом к стенке сарая, локтем глаза себе закрыл. Стоит — выкрикивает:

 
  — Раз, два, три, четыре, пять —

  Я иду искать! — Раз, два, три четыре, пять, шесть, семь, —

  Я иду совсем! — Раз, два, три, четыре… десять —

  Я иду на целый месяц. Когда всё до конца выкрикнул — палочку к стене приставил и поскорей обернулся. Ребятишки давно успели схорониться — кто куда. Никого нет. Только — глядь! — будто чьи-то босые ноги — брык! брык! — под сарай лезут, под дальний угол. И пропали там. — Вижу, вижу! — закричал Ваня — и бегом к тому углу. А в это время из-за другого угла сарая — Таня с Паней, а из-под куста — Маня. И к палочке-выручалочке. Стук, стук, стук! — и все трое «дома». Ну, да Ваня на них только рукой махнул: пускай! Одного-то он приметил, — уж этот от него не уйдёт. Добежал до угла. — Вылазь! — кричит в дыру под сараем. — Вылазь, Санька, вижу! Сам, конечно, ничего не видит, потому что под сараем яма, а в яме темно. Да ведь чьи-то ноги под сарай лезли? Лезли. Чьи же, как не Санькины? Девчонки уже все «дома». А тут сам Санька выскакивает в стороне из канавки — и бегом к палочке-выручалочке. Надо бы и Ване скорей к ней, — чтобы первому постучать, — да он растерялся. Как же так: ведь Санька под сараем сидит! И Ваня ещё раз крикнул в дыру:
— Вылазь, Санька! Всё равно — вылазь! Девчонки так со смеху и покатились. А Саня уж у палочки — стук, стук стук! — и кричит:
— Вот он — я! Води-ка в другой раз. Тут Ваня опомнился. А от угла не идёт. — Ребята, — говорит, — тут что-то не так. Тут с нами ещё кто-то в хоронушки играет. Вот сюда залез, — я своими глазами видел. Ребятишки к нему. Он стоит белый, как берёза, глаза большие, и шепчет:
— Вот тут, вот тут сидит… Я ноги видел. Лезет — ногами брыкается. Ребятишкам стало не по себе. Сумерки гуще. Лес рукой подать — и стоит тёмный, страшный. В лесу — волки, медведи и — как знать? — кто ещё. Неизвестно, кто под сарай забрался. Сидит там…
Санька — боевой парнишка — как крикнет толстым голосом:
— Кто там в яме? Объявись! А под сараем как шебуршнёт!.. Таня, Паня, Маня как взвизгнут, как припустят бежать! Хорошо — на меня набежали: как раз я из лесу шёл — с охоты. Еле их остановил. Рассказали мне, как всё было. Вижу — дело серьёзное. Пошёл к сараю. Девчонки за мной — издали. Саня с Ваней стоят у угла — в руках уже колья у них: хотят в яму толкать. — Обождите, — говорю. Погляжу раньше. Поставил я ружьё к стенке, опустился на четвереньки, чиркнул спичку. Батюшки светы, кто под сараем-то сидит! Я руку туда — и цоп его за уши! Уж как он ни брыкался, — так за уши и вытащил его ребятишкам. — Видали, кого струсили? Заяц, здоровый русачина! Вот глупый, куда схорониться вздумал. Косой этот всю зиму потом у девчонок в избе жил. Совсем ручной стал. Девчонки его так Санькой и прозвали. Забьётся, бывало, под печь, — спит там. А крикнуть ему: «Санька, вылазь! Вылазь, Санька!»—сейчас и выскочит. Дескать, не дадут ли капустки? Не очень-то, значит, глупый. Да уж там глупый не глупый, а тот раз маху дал: чем ему с ребятишками в хоронушки играть, под сарай лезть, сыграл бы лучше с ними в догонялки. Припустил бы назад к лесу, откуда пришёл, — кто б его догнал! Он ногастый. СИЛА НЕ БЕРЁТ


Удивляюсь я на певчих пташек: как только они на свете живут? Ни силы в них, ни весу, — пух да перо. В костях и то у них воздух. Прутиком хлестнёшь, — и дух вон. А ведь долгие годы здравствуют, ещё и песни поют — радуются. Гляди-ка, какие весёлые! Гусь — тот вон как по земле ступает. В соколе или, всё равно, в ястребе — в тех опять сила большая. Силой и берут. Добро бы ещё соловей: тот в роще живёт, в кустах. Этому есть где схорониться от ястреба. Чуть что — он в чащу — и был таков. Ну, а взять, к примеру, жаворонка. Этому куда деваться, когда кругом чистое поле? Хорошо там, если трава или рожь стоит в поле, — человека за ней не видать. А вот как я нынче полем шёл: хлеб-то машиной сжат весь подчистую. Мыши схорониться — и то негде. И бежит впереди меня по дороге жавороночек, по-нашему сказать: пахарёк. Люблю я эту пташку, хоть и всего-то в ней — ничего, песня одна. А уж как по весне обрадует, когда в лесу ещё зима полная, а он уж, пахарёк-то, над полем, над первой проталиной вьётся — песни своей серебро с поднебесья рассыпает. Иду я, конечно, по дороге по просёлочной — и он впереди меня бежит. Пробежит, пробежит — и станет. Подойду, — он дальше. И слетел. Слетел и ввысь забирает. Крылышками, гляжу, мелкомелко затрепетал — вот-вот запоёт. «А почему, — думаю, — ему и не запеть? День-то, гляди, какой тёплый да ласковый. На небе ни соринки, солнышко славно припекает, — даже пыль у меня из-под ног. Так, может, он лето вспомнил, гнёздышко свое тёплое во ржи». Пахарёк и вправду запел. Да на свою голову. Лучше б по сторонам глядел. Я-то ещё издали приметил а мчится на него лютый враг — крылья серпом — соколок-белогорлик. Я даже крикнул пахарьку-то:
— Глянь, летит!.. Будто он человеческие слова понимать может. Увидел, конечно, и он врага своего, да уж поздно: куда в чистом поле от быстрокрылого сокола денешься?"
