,Author Name,Author,Content
14,Булгаков,2," Гору замело, засыпало сарайчики во дворе – и стала гигантская сахарная голова. Дом накрыло шапкой белого генерала, и в нижнем этаже (на улицу – первый, во двор под верандой Турбиных – подвальный) засветился слабенькими желтенькими огнями инженер и трус, буржуй и несимпатичный, Василий Иванович Лисович, а в верхнем – сильно и весело загорелись турбинские окна.В сумерки Алексей и Николка пошли за дровами в сарай.– Эх, эх, а дров до черта мало. Опять сегодня вытащили, смотри.Из Николкиного электрического фонарика ударил голубой конус, а в нем видно, что обшивка со стены явно содрана и снаружи наскоро прибита.– Вот бы подстрелить чертей! Ейбогу. Знаешь что: сядем на эту ночь в караул? Я знаю – это сапожники из одиннадцатого номера. И ведь какие негодяи! Дров у них больше, чем у нас.– А ну их… Идем. Бери.Ржавый замок запел, осыпался на братьев пласт, поволокли дрова. К девяти часам вечера к изразцам Саардама нельзя было притронуться.Замечательная печь на своей ослепительной поверхности несла следующие исторические записи и рисунки, сделанные в разное время восемнадцатого года рукою Николки тушью и полные самого глубокого смысла и значения:«Если тебе скажут, что союзники спешат к нам на выручку, – не верь. Союзники – сволочи.Он сочувствует большевикам.»Рисунок: рожа Момуса.Подпись:«Улан Леонид Юрьевич».«Слухи грозные, ужасные,Наступают банды красные!»Рисунок красками: голова с отвисшими усами, в папахе с синим хвостом.Подпись:«Бей Петлюру!»Руками Елены и нежных и старинных турбинских друзей детства – Мышлаевского, Карася, Шервинского – красками, тушью, чернилами, вишневым соком записано:«Елена Васильевна любит нас сильно,Кому – на, а кому – не.»«Леночка, я взял билет на Аиду.Бельэтаж №8, правая сторона.»«1918 года, мая 12 дня я влюбился.»«Вы толстый и некрасивый.»«После таких слов я застрелюсь.»(Нарисован весьма похожий браунинг. )«Да здравствует Россия!Да здравствует самодержавие!»«Июнь. Баркарола.»«Недаром помнит вся РоссияПро день Бородина.»Печатными буквами, рукою Николки:«Я таки приказываю посторонних вещей на печке не писать под угрозой расстрела всякого товарища с лишением прав. Комиссар Подольского райкома. Дамский, мужской и женский портной Абрам Пружинер,1918 года, 30го января.»Пышут жаром разрисованные изразцы, черные часы ходят, как тридцать лет назад: тонктанк. Старший Турбин, бритый, светловолосый, постаревший и мрачный с 25 октября 1917 года, во френче с громадными карманами, в синих рейтузах и мягких новых туфлях, в любимой позе – в кресле с ногами. У ног его на скамеечке Николка с вихром, вытянув ноги почти до буфета, – столовая маленькая. Ноги в сапогах с пряжками. Николкина подруга, гитара, нежно и глухо: трень… Неопределенно трень… потому что пока что, видите ли, ничего еще толком не известно. Тревожно в Городе, туманно, плохо…На плечах у Николки унтерофицерские погоны с белыми нашивками, а на левом рукаве остроуглый трехцветный шеврон. (Дружина первая, пехотная, третий ее отдел. Формируется четвертый день, ввиду начинающихся событий. )Но, несмотря на все эти события, в столовой, в сущности говоря, прекрасно. Жарко, уютно, кремовые шторы задернуты. И жар согревает братьев, рождает истому.Старший бросает книгу, тянется.– А нука, сыграй «Съемки»…Треньтатам… Треньтатам…Сапоги фасонные,Бескозырки тонные,То юнкераинженеры идут!Старший начинает подпевать. Глаза мрачны, но в них зажигается огонек, в жилах – жар. Но тихонько, господа, тихонько, тихонечко.Здравствуйте, дачники,Здравствуйте, дачницы…Гитара идет маршем, со струн сыплет рота, инженеры идут – ать, ать! Николкины глаза вспоминают:Училище. Облупленные александровские колонны, пушки. Ползут юнкера на животиках от окна к окну, отстреливаются. Пулеметы в окнах.Туча солдат осадила училище, ну, форменная туча. Что поделаешь. Испугался генерал Богородицкий и сдался, сдался с юнкерами. Паазор…Здравствуйте, дачницы,Здравствуйте, дачники,Съемки у нас уж давно начались.Туманятся Николкины глаза.Столбы зноя над червонными украинскими полями. В пыли идут пылью пудренные юнкерские роты. Было, было все это и вот не стало. Позор. Чепуха.Елена раздвинула портьеру, и в черном просвете показалась ее рыжеватая голова. Братьям послала взгляд мягкий, а на часы очень и очень тревожный. Оно и понятно. Где же, в самом деле, Тальберг? Волнуется сестра.Хотела, чтобы это скрыть, подпеть братьям, но вдруг остановилась и подняла палец.– Погодите. Слышите?Оборвала рота шаг на всех семи струнах: стоой! Все трое прислушались и убедились – пушки. Тяжело, далеко и глухо. Вот еще раз: буу… Николка положил гитару и быстро встал, за ним, кряхтя, поднялся Алексей.В гостиной – приемной совершенно темно. Николка наткнулся на стул. В окнах настоящая опера «Ночь под рождество» – снег и огонечки. Дрожат и мерцают. Николка прильнул к окошку. Из глаз исчез зной и училище, в глазах – напряженнейший слух. Где? Пожал унтерофицерскими плечами.– Черт его знает. Впечатление такое, что будто под Святошиным стреляют. Странно, не может быть так близко.Алексей во тьме, а Елена ближе к окошку, и видно, что глаза ее черноиспуганны. Что же значит, что Тальберга до сих пор нет? Старший чувствует ее волнение и поэтому не говорит ни слова, хоть сказать ему и очень хочется. В Святошине. Сомнений в этом никаких быть не может. Стреляют в двенадцати верстах от города, не дальше. Что за штука?Николка взялся за шпингалет, другой рукой прижал стекло, будто хочет выдавить его и вылезть, и нос расплющил.– Хочется мне туда поехать. Узнать, в чем дело…– Ну да, тебя там не хватало…Елена говорит в тревоге. Вот несчастье. Муж должен был вернуться самое позднее, слышите ли, – самое позднее, сегодня в три часа дня, а сейчас уже десять.В молчании вернулись в столовую. Гитара мрачно молчит. Николка из кухни тащит самовар, и тот поет зловеще и плюется. На столе чашки с нежными цветами снаружи и золотые внутри, особенные, в виде фигурных колонок. При матери, Анне Владимировне, это был праздничный сервиз в семействе, а теперь у детей пошел на каждый день. Скатерть, несмотря на пушки и на все это томление, тревогу и чепуху, бела и крахмальна. Это от Елены, которая не может иначе, это от Анюты, выросшей в доме Турбиных. Полы лоснятся, и в декабре, теперь, на столе, в матовой, колонной, вазе голубые гортензии и две мрачных и знойных розы, утверждающие красоту и прочность жизни, несмотря на то, что на подступах к Городу – коварный враг, который, пожалуй, может разбить снежный, прекрасный Город и осколки покоя растоптать каблуками."
15,Бунин,3," ﻿I

  
   Окна в сад были открыты всю ночь. А деревья раскидывались густой листвой возле самых окон, и на заре, когда в саду стало светло, птицы так чисто и звонко щебетали в кустах, что отдавалось в комнатах. Но еще воздух и молодая майская зелень в росе были холодны и матовы, спальни дышали сном, теплом и покоем. Дом не походил на дачный; это был обыкновенный деревенский дом, небольшой, но удобный и покойный. Петр Алексеевич Примо, архитектор, занимал его уже пятое лето. Сам он больше бывал в разъездах или в городе. На даче жила его жена, Наталья Борисовна, и младший сын, Гриша. Старший, Игнатий, только что кончивший курс в университете, так же, как и отец, появлялся на даче гостем: он уже служил. В четыре часа в столовую вошла горничная. Сладко зевая, она переставляла мебель и шаркала половой щеткой. Потом она прошла через гостиную в комнату Гриши и поставила у кровати большие штиблеты на широкой подошве без каблука. Гриша открыл глаза. - Гарпина! - сказал он баритоном. Гарпина остановилась в дверях. - Чого? - спросила она шепотом. - Поди сюда. Гарпина покачала головой и вышла. - Гаприна! - повторил Гриша. - Та чого вам? - Поди сюда... на минутку. - Hе пiду, хоч зарiжте! Гриша подумал и крепко потянулся. - Ну, пошва вон! - Бариня загадали вчора спитать вас, чи поОдете у город? - А дальше? - Казали, щоб не Оздили, бо барин cьoгoлнi прыОдуть. Гриша, не отвечая, обувался. - Повотенце? - спросил он громко. - Та на столi - он! Не збудiть бариню...
   Заспанный, свежий и здоровый, в сером шелковом картузе, в широком костюме из легкой материи, Гриша вышел в гостиную, перекинул через плечо мохнатое полотенце, захватив стоявший в углу крокетный молоток, и, пройдя переднюю, отворил дверь на улицу, на пыльную дорогу. Дачи в садах тянулись направо и налево в одну линию. С горы открывался обширный вид на восток, на живописную низменность. Теперь все сверкало чистыми, яркими красками раннего утра. Синеватые леса темнели по долине; светлой, местами алой сталью блестела река в камышах и высокой луговой зелени; кое-где с зеркальной воды снимались и таяли полосы серебряного пара. А вдали широко и ясно разливался по небу оранжевый свет зари: солнце приближалось...
   Легко и сильно шагая, Гриша спустился с горы и дошел по мокрой, глянцевитой и резко пахнущей сыростью траве до купальни. Там, в дощатом номере, странно озаренном матовым отсветом воды, он разделся и долго разглядывал свое стройное тело и гордо ставил свою красивую голову, чтобы походить на статуи римских юношей. Потом, слегка прищуривая серые глаза и посвистывая, вошел в свежую воду, выплыл из купальни и сильно взмахнул руками, увидав, что на горизонте чуть-чуть показавшееся солнце задрожало тонкой огнистой полоской. Белые гуси с металлически-звонкими криками, распустив крылья и шумно бороздя воду, тяжело шарахнулись в тростники. Широкие круги, плавно перекатываясь, закачались и пошли к реке...
   - Григорий Петрович! - крикнул чей-то голос с берега. Гриша перевернулся и увидал на берегу высокого мужика с русой бородою, с открытым лицом и ясным взглядом больших голубых глаз навыкате. Это был Каменский, ""толстовец"", как его называли на дачах. - Вы придете сегодня? - крикнул Каменский, снимая картуз и вытирая лоб рукавом замашной рубахи. - Здравствуйте!.. Приду, - отозвался Гриша. - А вы куда, если не секрет? Каменский с улыбкой взглянул исподлобья. - Ведь вот люди! - сказал он важно и ласково. - Всё у них секреты! Гриша подплыл к берегу и, стоя и качаясь по горло в воде, пробормотал:
   - Ну, если хотите, не секрет... Я просто полюбопытствовал, почему вы меня спросили? - А мне нужно побывать у знакомых. - Да, так вы в город едете! - Разве в город только ездят? - снова перебил Каменский. - И разве знакомые бывают только в городе? - Конечно, нет. Только я не понимаю...
   - Вот это верно. Я сказал, что буду и в городе и у знакомых - вот тут недалеко - на огородах. - Так, значит, попоздней прийти? - Да, попоздней. - Тогда до свидания! - крикнул Гриша и подумал: ""Правду говорит Игнатий - психопаты!"" Но, отплывши, он опять обернулся и пристально посмотрел на высокую фигуру в мужицкой одежде, уходившую по тропинке вдоль реки. На реке еще было прохладно и тихо. За лугами, в синеющей роще, куковала кукушка. У берега зашуршали камыши, и из них медленно выплыла лодка. Седенький старичок в очках и поломанной соломенной шляпе сидел в ней, рассматривая удочку. Он поднял ее и соображал что-то, лодка остановилась и вместе с ним, с его белой рубашкой и шляпой, отразилась в воде. А из купальни слышались крики, плеск и хохот. По гнущимся доскам бежали с берега, стуча сапогами, гимназисты, студенты в белых кителях, чиновники в парусинных рубашках...
   Грише не хотелось возвращаться туда, и он стал нырять, раскрывать глаза в темно-зеленой воде, и его тело казалось ему чужим и странным, словно он глядел сквозь стекло. Караси и гольцы с удивленными глазками останавливались против него и вдруг таинственно юркали куда-то в темную и холодную глубину. Вода мягко, упруго сжимала и качала тело, и приятно было чувствовать под ногами жесткий песок и раковины... А наверху уже припекало. Теплая, неподвижная вода блестела кругом, как зеркало. С зеленых прибрежных лозин в серых сережках тихо плыл белый пух и тянуло запахом тины и рыбы. II

  
   Ровно час после купанья Гриша посвятил гимнастике. Сперва он подтягивался по канату и висел на трапеции в саду, потом в своей комнате становился в львиные позы, играя двухпудовыми гирями. Со двора звонко и весело раздавалось кудахтанье кур. В доме еще стояла тишина светлого летнего утра. Гостиная соединялась со столовой аркой, а к столовой примыкала еще небольшая комната, вся наполненная пальмами и олеандрами в кадках и ярко озаренная янтарным солнечным светом. Канарейка возилась там в покачивающейся клетке, и слышно было, как иногда сыпались, четко падали на пол зерна семени. В большом трюмо, перед которым Гриша ворочал тяжестями, вся эта комната отражалась в усиленно-золотистом освещении с неестественно прозрачной зеленью широкой цветочной листвы. Когда же Гриша вышел на балкон, сел за накрытый стол и, покачиваясь на передних ножках стула, стал, слегка расширяя ноздри, медленно пить молоко, в тишине дома раздался томный голос Натальи Борисовны:
   - Гарпина! ""Какая скука! - подумал Гриша. - Каждый день начинается одним и тем же воззванием!"" - Гарпина! - повторила Наталья Борисовна нетерпеливее. - Гри-иша! Гриша лениво поднялся с места. - Ну, что тебе? - сказал он, входя в спальню. Наталья Борисовна, полная женщина лет сорока, сидела на постели и, подняв руки, подкалывала темные густые волосы."
