,Author Name,Author,Content
4,Андреев,0," ﻿I

Уже четыре недели жил он в доме — и четыре недели в доме царили страх и беспокойство. Все старались говорить и поступать так, как они всегда поступали и говорили, и не замечали того, что речи их звучат глуше, что глаза их смотрят виновато и тревожно и часто оборачиваются в ту сторону, где находится отведенная ему комната. В противоположном от нее конце дома они ступали ногами неестественно-громко и так же неестественно-громко смеялись, но, когда им случалось проходить мимо белых дверей, которые весь день были заперты изнутри и так глухи, точно за ними не было ничего живого, они умеряли шаг, а все тело их подавалось в сторону, словно в ожидании удара. И хотя проходившие становились на пол всей ногой, но шаг их был более легок и более беззвучен, чем если бы они шли на цыпочках. И никто не называл его по имени, а просто словом «он», и так как все каждую минуту думали о нем, то это неопределенное название представлялось более ясным, чем полное имя, и никогда не заставляло переспрашивать. Почему-то казалось непочтительным и фамильярным звать его, как зовут других; слово же «он» точно и резко выражало страх, который внушала его высокая, сумрачная фигура. И только одна старая бабушка, которая жила наверху, звала его Колей, но и она испытывала напряженное состояние страха и ожидания беды, охватившее весь дом, и часто плакала. Однажды она спросила горничную Катю, почему барышня не играет сегодня на фортепьяно, но Катя удивленно взглянула на нее и не ответила, а, уходя, покачала головой, точно не одобряла самого вопроса. Пришел он в серый ноябрьский полдень, когда все были дома и сидели за чаем, кроме Пети, давно уже ушедшего в гимназию. На дворе было холодно, и низко нависшие плотные тучи сеяли дождь, так что, несмотря на большие окна, в высоких комнатах было темно, а в некоторых горел даже огонь. Звонок его был резкий и властный, и сам Александр Антонович вздрогнул; он подумал, что явился кто-нибудь из важных посетителей, и медленно пошел навстречу, сделав на своем полном и серьезном лице приветливо-ласковую улыбку. Но она тотчас исчезла, когда в полутьме прихожей он увидел бедно и грязно одетого человека, перед которым в смущении стояла горничная, робко загораживая ему путь. Вероятно, с вокзала он шел пешком и только местами ехал на конке, потому что коротенькое потертое пальто его было мокро, а брюки внизу забрызганы и стояли коробом от воды и грязи. И голос его был хриплый, грубый, не то от сырости и простуды, не то от долгого молчания в тряском вагоне. — Чего молчите? Дома, спрашиваю вас, Александр Антоныч Барсуков? — повторил вошедший свой вопрос. Но отозвался Александр Антонович. Не входя в переднюю, он вполоборота взглянул на человека, которого счел за одного из бесчисленных просителей, и строго сказал:

— Вам что здесь нужно? — Не узнал, отец? — насмешливо, но с дрожью в голосе спросил вошедший. — А ведь я Николай, по отчеству Александрыч. — Какой… Николай? — отступил на шаг Александр Антонович. Но, спрашивая, он уже знал, какой Николай стоит перед ним. Важность исчезла с его лица, и оно стало бледно страшной старческой бледностью, похожей на смерть, и руки поднялись к груди, откуда внезапно вышел весь воздух. Следующим порывистым движением обе руки обняли Николая, и седая холеная борода прикоснулась к черной мокрой бородке, и старческие, отвыкшие целовать губы искали молодых свежих губ и с ненасытной жадностью впивались в них. — Погоди, отец, дай раздеться, — мягко говорил Николай. — Простил? Простил? — дрожал всем телом Александр Антонович. — Ну, что за глупости! — сурово и строго сказал Николай, отстраняя отца. — Какое еще там прощение? Когда они входили в столовую, Александру Антоновичу было стыдно своего порыва, которому с такой неудержимой силой отдалось его доброе сердце. Но радость от свидания, хотя и отравленная, бурлила в груди и искала выхода, и вид сына, который пропадал неведомо где в течение целых семи лет, делала его походку быстрой и молодой и движения порывистыми и несолидными. И он искренне рассмеялся, когда Николай остановился перед сестрой и, потирая озябшие руки, спросил:

— А эта барышня — сестрица, что ли? Ниночка, семнадцатилетняя девушка, бледненькая и худенькая, стояла у своего места и смущенно перебирала по столу пальцами, устремив на брата большие испуганные глаза. Она догадалась, что это Николай, которого она помнила больше, чем сам отец, и теперь не знала, что делать. И когда Николай, вместо поцелуя, пожал ей руку, она ответила крепким пожатием и чуть, по-институтски, не присела. — А это господин студент Андрей Егорыч — Петькин репетитор, — знакомил Александр Антонович. — Петька? — удивился Николай. — Да он уже учится! Важно! Потом его познакомили с остролицей дамой, которая наливала чай и которую называли просто Анной Ивановной, и потом все стали жадно рассматривать его, пока он в свою очередь оглядывал комнату, желая узнать, все ли так, как было семь лет тому назад. Было в нем что-то странное, не поддающееся определению. Высоким ростом, гордым поворотом головы, пронзительным взглядом черных глаз из-под крутых, выпуклых бровей, он напоминал молодого орла. Дикостью и свободой веяло от его прихотливо разметавшихся волос; трепетной грацией хищника, выпускающего когти, дышали все его движения, уверенные, легкие, бесшумные; и руки без колебаний находили и брали то, что им нужно. Словно не сознавая неловкости своего положения, он смотрел в глаза каждому глубоко и спокойно, но даже и в ту минуту, когда взгляд был ласков, в нем чудилось что-то затаенное и опасное, что видится всегда в глазах ласкающегося хищника. И говорил он повелительно и просто, видимо, не обдумывая своих слов, точно это были не ошибающиеся, невольно лгущие звуки человеческой речи, а непосредственно звучала сама мысль. Чувство раскаяния не могло иметь места в душе такого человека. Но если это был орел, то перья его были сильно помяты в схватке, из которой он едва ли ушел победителем. Об этом говорило платье, носившее на себе следы ночевок, грязное, непригнанное к телу; и было в этом платье что-то неуловимо-хищное, тревожное, заставляющее всех хорошо одетых людей испытывать смутное чувство опасения. И минутами по всему статному и сильному телу пробегала мгновенная дрожь странной боязни; тогда все тело как будто становилось меньше, и казалось, что волосы на затылке поднимаются как у ощетинившегося зверя; и глаза быстро и злобно обегали всех присутствующих."
5,Бианки,1," ﻿КУЗЯ ДВУХВОСТЫЙ


Сергейке очень хотелось поймать какую-нибудь птичку, особенно кузю — большую белощёкую синицу. Уж очень они — кузи — весёлые, бойкие, смелые. Клетка у Сергейки была, а западню ему дали товарищи. На три дня дали. И в первый же день Сергейке попался в западню кузя. Сергейка принёс его домой и стал пересаживать из западни в клетку. Но кузя так бился, дрался и клевался, что Сергейка ненарочно выдрал у него несколько перьев из хвоста. И стал кузя двухвостый: сзади по бокам торчат перья вилочкой, а посредине ничего нет. Сергейка подумал: «Куда мне двухвостого! Мальчишки засмеют, скажут: «Общипанный, в суп его надо». И решил кузю выпустить и наловить других птиц. Два дня ещё оставалось у него. А кузя прыгает себе с жёрдочки на жёрдочку, перевёртывается вниз головой, как обезьяна, и долбит своим крепким клювиком зёрна. Солнце в комнату заглянет, он запоёт:
— Зин-зи-вер, зин-зи-верр! — так весело, звонко. Будто никогда и на воле не был, всегда жил в клетке. Сергей стал его выгонять из клетки, — кузя как крикнет:
— Пинь-пинь-черрр! — как зашипит на него! Пришлось выставить клетку в окно и открыть дверцу. Улетел кузя. Сергейка опять западню поставил. Утром приходит и ещё издали видит: захлопнута западня, кто-то попался. Подошёл, а в западне кузя сидит» Да не какой-нибудь, а тот самый: двухвостый! — Кузенька! — взмолился Сергейка. — Ты же мне мешаешь других птиц ловить. Один только день и остался мне ловить их. Он взял западню с кузей и пошёл прочь от дома. Шёл-шёл, пришёл в середину леса и там выпустил кузю. Кузя крикнул:
— Пинь-пинь-черрр! — И скрылся в чаще. Сергейка вернулся домой и опять поставил западню. На другой день приходит, — опять кузя двухвостый в западне! — Пинь-пинь-черррр! Чуть не расплакался Сергейка. Выгнал кузю и отнёс западню хозяевам. Прошло несколько дней, Сергейка скучал и уже стал думать: «Зачем я кузю выгнал? Хотя и двухвостый, а какой весёлый». Вдруг за окном:
— Пинь-пиньгчерррр! Сергейка открыл окно, и кузя сейчас же влетел в избу. Прилепился к потолку, перелетел на стену, увидал таракашку, тюкнул его носом и съел. И стал кузя жить в избе у Сергейки. Захочет — в клетку залетит, зёрнышек поклюёт, выкупается в ванночке и опять вылетит: Сергейка клетку не закрывал. Захочет — по всей избе летает, тараканов ищет. Склевал всех тараканов, крикнул «пинь-пинь-черр!» и улетел."
