,Author Name,Author,Content
0,Андреев,0," ﻿I

Он сильно пил, потерял работу и знакомых и поселился в подвале вместе с ворами и проститутками, проживая последние вещи. У него было больное, бескровное тело, изношенное в работе, изъеденное страданиями и водкой, и смерть уже сторожила его, как хищная серая птица, слепая при солнечном свете и зоркая в черные ночи. Днем она пряталась в темных углах, а ночью бесшумно усаживалась у его изголовья и сидела долго, до самого рассвета, и была спокойна, терпелива и настойчива. Когда при первых проблесках дня он высовывал из-под одеяла бледную голову с глазами травимого зверя, в комнатке было уже пусто, — но он не верил этой обманчивой пустоте, которой верят другие. Он подозрительно оглядывал углы, с хитрой внезапностью бросал взгляд за спину и потом, опершись на локти, внимательно и долго смотрел перед собой в тающую тьму уходящей ночи. И тогда он видел то, чего никогда не видят другие: колыхание серого огромного тела, бесформенного и страшного. Оно было прозрачно, охватывало все, и предметы в нем были как за стеклянной стеной. Но теперь он не боялся его, и, оставляя холодный след, оно уходило — до следующей ночи. На короткое время он забывался, и сны приходили к нему страшные и необыкновенные. Он видел белую комнату, с белым полом и стенами, освещенную белым ярким светом, и черную змею, которая выползала из-под двери с легким шуршанием, похожим на смех. Прижав к полу острую, плоскую голову и извиваясь, она быстро выскальзывала, куда-то пропадала, и опять в отверстии под дверью показывался ее приплюснутый черный нос, и черной лентой вытягивалось тело, — и опять и опять. Раз он увидел во сне что-то веселое и засмеялся, но звук получился странный, похожий на подавленное рыдание, и было страшно его слушать: где-то в безвестной глубине смеется, не то плачет душа, в то время когда тело неподвижно, как у мертвого. Постепенно в его сознание начинали входить звуки рождающегося дня: глухой говор прохожих, отдаленный скрип двери, громыхание дворницкой метлы, сметающей снег с подоконника, — весь неопределенный гул просыпающегося большого города. И тогда наступало для него самое ужасное: беспощадно светлое сознание, что пришел новый день и скоро ему нужно вставать, чтобы бороться за жизнь без надежды на победу. Нужно жить. Он поворачивался спиной к свету, набрасывал на голову одеяло, чтобы ни малейший луч не мог проникнуть в его глаза, сжимался в маленький комок, подтягивая ноги к самому подбородку, и так лежал неподвижно, боясь пошевелиться и протянуть ноги. Целой горой лежала на нем одежда, которою он укрывался от подвальной стужи, но он не чувствовал ее тяжести, и тело его было холодно. И при каждом звуке, говорившем о жизни, он казался себе огромным и открытым, сжимался еще больше и беззвучно стонал — не голосом и не мыслью, так как теперь он боялся собственного голоса и собственных мыслей. Он молился кому-то, чтобы день не приходил и ему всегда можно было лежать под грудой тряпья, не шевелясь и не мысля, и напрягал всю волю, чтобы удержать идущий день и уверить себя, что ночь еще продолжается, И больше всего в мире ему хотелось, чтобы кто-нибудь сзади приложил револьвер к затылку, к тому месту, где чувствуется углубление, и выстрелил. А день развертывался — широкий, неудержимый, властно зовущий к жизни, и весь мир начинал двигаться, говорить, работать и думать. В подвале первой просыпалась хозяйка, старуха Матрена, имевшая двадцатипятилетнего любовника, и начинала топать по кухне, стучать ведрами и возиться над чем-то у самых дверей Хижнякова. Он чувствовал ее приближение и замирал, решаясь не отзываться, если она его позовет. Но она молчала и куда-то уходила, а потом часа через два просыпались двое других жильцов: гулящая девушка Дуняша и любовник старухи, Абрам Петрович. Так почтительно, несмотря на молодость, звали его все, потому что он был смелый и искусный вор и еще что-то, о чем только подозревали, но не решались говорить. Их пробуждения больше всего страшился Хижняков, так как оба они имели на него право, могли войти, сесть на кровать, трогать его руками и вызывать его на мысли и разговоры. С Дуняшей он как-то сошелся, пьяный, и обещал на ней жениться, и хотя она смеялась и хлопала его по плечу, но искренно считала его влюбленным в себя и покровительствовала, а сама была глупая, грязная, дурно пахнущая и часто ночевала в участке. А с Абрамом Петровичем он только третьего дня вместе пьянствовал, целовался и давал клятвы в вечной дружбе. Когда раздался свежий и громкий голос Абрама Петровича и его быстрые шаги мимо двери, Хижняков застыл от страха и ожидания, простонал, не сдержавшись, вслух и еще более испугался. В одной яркой картине перед ним пронеслось его пьянство, как они сидели в каком-то темном трактире, освещенном одной лампой, среди темных, шепчущихся почему-то людей, и тоже шептались. Абрам Петрович, бледный и возбужденный, жаловался на трудную жизнь вора, зачем-то обнажал руку и давал щупать неправильно сросшиеся кости, а Хижняков целовал его и говорил:

— Я люблю воров. Они смелые, — и предлагал ему выпить на брудершафт, хотя они давно говорили на ты. — А я люблю тебя, что ты образованный и понимаешь нашего брата, — отвечал Абрам Петрович. — Гляди-ка, рука-то: она вот! И опять перед его глазами протягивалась белая рука, казавшаяся жалкой от своей белизны, и в внезапном понимании чего-то, чего он теперь не помнил и не понимал, он целовал эту руку, а Абрам Петрович горделиво кричал:

— Верно, брат! Помрем, а не сдадимся! А потом что-то грязное, кружащееся, вой, свист и прыгающие огни. И тогда это было весело, а теперь, когда в углах пряталась смерть и отовсюду надвигался день с необходимостью жить, и действовать, и за что-то бороться, о чем-то просить, — было мучительно и непередаваемо ужасно. — Барин, спишь? — насмешливо спросил за дверью Абрам Петрович и, не получив ответа, добавил: — Ну спи, черт с тобой. К Абраму Петровичу приходит много знакомых, и в течение целого дня визжит дверь и раздаются басистые голоса. И Хижнякову при каждом стуке кажется, что это пришли к нему и за ним, и он прячется все глубже и долго прислушивается, пока поймет, кому принадлежит голос."
1,Андреев,0," ﻿Когда поздней ночью он звонил у своих дверей, первым звуком после колокольчика был звонкий собачий лай, в котором слышались и боязнь чужого и радость, что это идет свой. Потом доносилось шлепанье калош и скрип снимаемого крючка. Он входил и раздевался в темноте, чувствуя недалеко от себя молчаливую женскую фигуру. А колена его ласково царапали когти собаки, и горячий язык лизал застывшую руку. — Ну, что? — спрашивал заспанный голос тоном официального участия. — Ничего. Устал, — коротко отвечал Владимир Михайлович и шел в свою комнату. За ним, стуча когтями по вощеному полу, шла собака и вспрыгивала на кровать. Когда свет зажженной лампы наполнял комнату, взор Владимира Михайловича встречал упорный взгляд черных глаз собаки. Они говорили: приди же, приласкай меня. И, чтобы сделать это желание более понятным, собака вытягивала передние лапы, клала на них боком голову, а зад ее потешно поднимался, и хвост вертелся, как ручка у шарманки. — Друг ты мой единственный! — говорил Владимир Михайлович и гладил черную блестящую шерсть. Точно от полноты чувства, собака опрокидывалась на спину, скалила белые зубы и легонько ворчала, радостная и возбужденная. А он вздыхал, ласкал ее и думал, что нет больше на свете никого, кто любил бы его. Если Владимир Михайлович возвращался рано и не уставал от работы, он садился писать, и тогда собака укладывалась комочком где-нибудь на стуле возле него, изредка открывала один черный глаз и спросонья виляла хвостом. И когда, взволнованный процессом творчества, измученный муками своих героев, задыхающийся от наплыва мыслей и образов, он ходил по комнате и курил папиросу за папиросой, она следила за ним беспокойным взглядом и сильнее виляла хвостом. — Будем мы с тобой знамениты, Васюк? — спрашивал он собаку, и та утвердительно махала хвостом. — Будем тогда печенку есть, ладно? «Ладно», — отвечала собака и сладко потягивалась: она любила печенку. У Владимира Михайловича часто собирались гости. Тогда его тетка, с которой он жил, добывала у соседей посуду, поила чаем, ставя самовар за самоваром, ходила покупать водку и колбасу и тяжело вздыхала, доставая со дна кармана засаленный рубль. В накуренной комнате звучали громкие голоса. Спорили, смеялись, говорили смешные и острые вещи, жаловались на свою судьбу и завидовали друг другу; советовали Владимиру Михайловичу бросить литературу и заняться другим, более выгодным делом. Одни говорили, что ему нужно лечиться, другие чокались с ним рюмками и говорили о вреде водки для его здоровья. Он такой больной, постоянно нервничающий. Оттого у него припадки тоски, оттого он ищет в жизни невозможного. Все говорили с ним на «ты», и в голосе их звучало участье, и они дружески звали его с собой ехать за город продолжать попойку. И когда он, веселый, кричащий больше всех и беспричинно смеющийся, уезжал, его провожали две пары глаз: серые глаза тетки, сердитые и упрекающие, и черные, беспокойно ласковые глаза собаки. Он не помнил, что он делал, когда пил и когда к утру возвращался домой, выпачканный в грязи и мелу и потерявший шляпу. Передавали ему, что во время попойки он оскорблял друзей, а дома обижал тетку, которая плакала и говорила, что не выдержит такой жизни и удавится, и мучил собаку за то, что она не идет к нему ласкаться. Когда же она, испуганная и дрожащая, скалила зубы, то бил ее ремнем. Наступал следующий день; все уже кончали свою дневную работу, а он просыпался, больной и страдающий. Сердце неровно колотилось в груди и замирало, наполняя его страхом близкой смерти, руки дрожали. За стеной, в кухне, стучала тетка, и звук ее шагов разносился по пустой и холодной квартире. Она не заговаривала с Владимиром Михайловичем и молча подавала ему воду, суровая, непрощающая. И он молчал, смотрел на потолок в одно давно им замеченное пятнышко и думал, что он сжигает свою жизнь, и никогда у него не будет ни славы, ни счастья. Он сознавал себя ничтожным, и слабым, и одиноким до ужаса. Бесконечный мир кишел движущимися людьми, и не было ни одного человека, который пришел бы к нему и разделил его муки, безумно-горделивые помыслы о славе и убийственное сознание ничтожества. Дрожащей, ошибающейся рукой он хватался за холодный лоб и сжимал веки, но, как ни крепко он их сжимал, слеза просачивалась и скользила по щеке, еще сохранившей запах продажных поцелуев. А когда он опускал руку, она падала на другой лоб, шерстистый и гладкий, и затуманенный слезой взгляд встречал черные, ласковые глаза собаки, и ухо ловило ее тихие вздохи. И он шептал, тронутый, утешенный:

— Друг, друг мой единственный!.. Когда он выздоравливал, к нему приходили друзья и мягко упрекали его, давали советы и говорили о вреде водки. А те из друзей, кого он оскорбил пьяный, переставали кланяться ему. Они понимали, что он не хотел им зла, но они не желали натыкаться на неприятность. Так, в борьбе с самим собой, неизвестностью и одиночеством, протекали угарные, чадные ночи и строго карающие светлые дни. И часто в пустой квартире гулко отдавались шаги тетки, и на кровати слышался шепот, похожий на вздох:

— Друг, друг мой единственный!.. И наконец она пришла, эта неуловимая слава, пришла, нежданная-негаданная, и наполнила светом и жизнью пустую квартиру. Шаги тетки тонули в топоте дружеских ног, призрак одиночества исчез, и замолк тихий шепот. Исчезла и водка, этот зловещий спутник одиноких, и Владимир Михайлович более не оскорблял ни тетки, ни друзей. Радовалась и собака. Еще звончее стал ее лай при поздних встречах, когда он, ее единственный друг, приходил добрый, веселый, смеющийся, и она сама научилась смеяться; верхняя губа ее приподнималась, обнажая белые зубы, и потешными складками морщился нос. Веселая, шаловливая, она начинала играть, хватала его вещи и делала вид, что хочет унести их, а когда он протягивал руки, чтобы поймать ее, подпускала его на шаг и снова убегала, и черные глаза ее искрились лукавством. Иногда он показывал собаке на тетку и кричал: «куси», и собака с притворным гневом набрасывалась на нее, тормошила ее юбку и, задыхаясь, косилась черным лукавым глазом на друга. Тонкие губы тетки кривились в суровую улыбку, она гладила заигравшуюся собаку по блестящей голове и говорила:

— Умная собака, только вот супу не любит. А по ночам, когда Владимир Михайлович работал и только дребезжание стекол от уличной езды нарушало тишину, собака чутко дремала возле него и пробуждалась при малейшем его движении."
