,Author Name,Author,Content
10,Булгаков,2," I

Давно уже отмечено умными людьми, что счастье — как здоровье: когда оно налицо, его не замечаешь. Но когда пройдут годы, — как вспоминаешь о счастье, о, как вспоминаешь! Что касается меня, то я, как выяснилось это теперь, был счастлив в 1917 году, зимой. Незабываемый, вьюжный, стремительный год! Начавшаяся вьюга подхватила меня, как клочок изорванной газеты, и перенесла с глухого участка в уездный город[1]. Велика штука, подумаешь, уездный город? Но если кто-нибудь подобно мне просидел в снегу зимой, в строгих и бедных лесах летом, полтора года, не отлучаясь ни на один день, если кто-нибудь разрывал бандероль на газете от прошлой недели с таким сердечным биением, точно счастливый любовник голубой конверт, ежели кто-нибудь ездил на роды за восемнадцать верст в санях, запряженных гуськом, тот, надо полагать, поймет меня. Уютнейшая вещь керосиновая лампа, но я за электричество! И вот я увидел их вновь, наконец, обольстительные электрические лампочки! Главная улица городка, хорошо укатанная крестьянскими санями, улица, на которой, чаруя взор, висели — вывеска с сапогами, золотой крендель, красные флаги, изображение молодого человека со свиными и наглыми глазками и с абсолютно неестественной прической, означавшей, что за стеклянными дверями помещается местный Базиль, за тридцать копеек бравшийся вас брить во всякое время, за исключением дней праздничных коими изобилует отечество мое. До сих пор с дрожью вспоминаю салфетки Базиля, салфетки, заставлявшие неотступно представлять себе ту страницу в германском учебнике кожных болезней, на которой с убедительной ясностью изображен твердый шанкр на подбородке у какого-то гражданина. Но и салфетки эти все же не омрачат моих воспоминаний! На перекрестке стоял живой милиционер, в запыленной витрине смутно виднелись железные листы с тесными рядами пирожных с рыжим кремом, сено устилало площадь, и шли, и ехали, и разговаривали, в будке торговали вчерашними московскими газетами, содержащими в себе потрясающие известия[2], невдалеке призывно пересвистывались московские поезда. Словом, это была цивилизация, Вавилон, Невский проспект. О больнице и говорить не приходится. В ней было хирургическое отделение, терапевтическое, заразное, акушерское. В больнице была операционная, в ней сиял автоклав, серебрились краны, столы раскрывали свои хитрые лапы, зубья, винты. В больнице был старший врач, три ординатора (кроме меня), фельдшера, акушерки, сиделки, аптека и лаборатория. Лаборатория, подумать только! С цейсовским микроскопом, прекрасным запасом красок. Я вздрагивал и холодел, меня давили впечатления. Немало дней прошло, пока я не привык к тому, что одноэтажные корпуса больницы в декабрьские сумерки, словно по команде, загорались электрическим светом. Он слепил меня. В ваннах бушевала и гремела вода, и деревянные измызганные термометры ныряли и плавали в них. В детском заразном отделении весь день вспыхивали стоны, слышался тонкий жалостливый плач, хриплое бульканье...
Сиделки бегали, носились...
Тяжкое бремя соскользнуло с моей души. Я больше не нес на себе роковой ответственности за все, что бы ни случилось на свете. Я не был виноват в ущемленной грыже и не вздрагивал, когда приезжали сани и привозили женщину с поперечным положением, меня не касались гнойные плевриты, требовавшие операции... Я почувствовал себя впервые человеком, объем ответственности которого ограничен какими-то рамками. Роды? — Пожалуйста, вон — низенький корпус, вон — крайнее окно, завешенное белой марлей. Там врач-акушер, симпатичный и толстый, с рыженькими усиками и лысоватый. Это его дело. Сани, поворачивайте к окну с марлей! Осложненный перелом — главный врач-хирург. Воспаление легких? — В терапевтическое отделение к Павлу Владимировичу. О, величественная машина большой больницы на налаженном, точно смазанном ходу! Как новый винт по заранее взятой мерке, и я вошел в аппарат и принял детское отделение. И дифтерит, и скарлатина поглотили меня, взяли мои дни. Но только дни. Я стал спать по ночам, потому что не слышалось более под моими окнами зловещего ночного стука, который мог поднять меня и увлечь в тьму на опасность и неизбежность. По вечерам я стал читать (про дифтерит и скарлатину, конечно, в первую голову и затем почему-то со странным интересом Фенимора Купера) и оценил вполне и лампу над столом, и седые угольки на подносе самовара, и стынущий чай, и сон после бессонных полутора лет...
Так я был счастлив в 17-м году зимой, получив перевод в уездный город с глухого вьюжного участка. II

Пролетел месяц, за ним второй и третий, 17-й год отошел, и полетел февраль 18-го. Я привык к своему новому положению и мало-помалу свой дальний участок стал забывать. В памяти стерлась зеленая лампа с шипящим керосином, одиночество, сугробы... Неблагодарный! Я забыл свой боевой пост, где я один без всякой поддержки боролся с болезнями, своими силами, подобно герою Фенимора Купера, выбираясь из самых диковинных положений. Изредка, правда, когда я ложился в постель с приятной мыслью о том, как сейчас я усну, какие-то обрывки проносились в темнеющем уже сознании. Зеленый огонек, мигающий фонарь... скрип саней... короткий стон, потом тьма, глухой вой метели в полях... Потом все это боком кувыркалось и проваливалось...
«Интересно, кто там сидит сейчас на моем месте?.. Кто-нибудь да сидит... Молодой врач вроде меня... Ну, что же, я свое высидел. Февраль, март, апрель... ну, и, скажем, май — и конец моему стажу. Значит, в конце мая я расстанусь с моим блистательным городом и вернусь в Москву. И ежели революция подхватит меня на свое крыло — придется, возможно, еще поездить... но, во всяком случае, своего участка я более никогда в жизни не увижу... Никогда... Столица... Клиника... Асфальт, огни....»
Так думал я. «...А все-таки хорошо, что я пробыл на участке... Я стал отважным человеком... Я не боюсь... Чего я только не лечил?! В самом деле? А?.. Психических болезней не лечил... Ведь... верно, нет, позвольте... А агроном допился тогда до чертей... И я его лечил, и довольно неудачно... Белая горячка...
Чем не психическая болезнь? Почитать надо бы психиатрию... Да ну ее... Как-нибудь впоследствии в Москве... А сейчас, в первую очередь, детские болезни... и еще детские болезни... и в особенности эта каторжная детская рецептура... Фу, черт... Если ребенку десять лет, то, скажем, сколько пирамидону ему можно дать на прием? 0,1 или 0,15?.. Забыл. А если три года?.. Только детские болезни... и ничего больше... довольно умопомрачительных случайностей! Прощай, мой участок!.. И почему мне этот участок так настойчиво сегодня вечером лезет в голову?.. Зеленый огонь... Ведь я покончил с ним расчеты на всю жизнь... Ну и довольно... Спать...»

— Вот письмо. С оказией привезли...
— Давайте сюда. Сиделка стояла у меня в передней. Пальто с облезшим воротником было накинуто поверх белого халата с клеймом. На синем дешевом конверте таял снег. — Вы сегодня дежурите в приемном покое? — спросил я, зевая. — Я. — Никого нет? — Нет, пусто. — Ешли... (зевота раздирала мне рот, и от этого слова я произносил неряшливо), кого-нибудь привежут... вы дайте мне знать шюда... Я лягу спать...
— Хорошо. Можно иттить? — Да, да. Идите. Она ушла. Дверь визгнула, а я зашлепал туфлями в спальню, по дороге безобразно и криво раздирая пальцами конверт. В нем оказался продолговатый смятый бланк с синим штемпелем моего участка, моей больницы... Незабываемый бланк...
Я усмехнулся. «Вот интересно... весь вечер думал об участке, и вот он явился сам напомнить о себе... Предчувствие...»
Под штемпелем химическим карандашом был начертан рецепт. Латинские слова, неразборчивые, перечеркнутые...
— Ничего не понимаю... Путаный рецепт... — пробормотал я и уставился на слово «morphini...». Что, бишь, тут необычайного в этом рецепте?.. Ах да... Четырехпроцентный раствор! Кто же выписывает четырехпроцентный раствор морфия?.. Зачем?! Я перевернул листок, и зевота моя прошла. На обороте листка чернилами, вялым и разгонистым почерком было написано:

«11 февраля 1918 года. Милый collega! Извините, что пишу на клочке. Нет под руками бумаги. Я очень тяжко и нехорошо заболел. Помочь мне некому, да я и не хочу искать помощи ни у кого, кроме Вас. Второй месяц я сижу на бывшем Вашем участке, знаю, что Вы в городе и сравнительно недалеко от меня. Во имя нашей дружбы и университетских лет прошу Вас приехать ко мне поскорее. Хоть на день. Хоть на час. И если Вы скажете, что я безнадежен, я Вам поверю... А может быть, можно спастись?.. Да, может быть, еще можно спастись?.. Надежда блеснет для меня? Никому, прошу Вас, не сообщайте о содержании этого письма». — Марья! Сходите сейчас же в приемный покой и вызовите ко мне дежурную сиделку... как ее зовут?.. Ну, забыл... Одним словом, дежурную, которая мне письмо принесла сейчас. Поскорее! — Счас. Через несколько минут сиделка стояла передо мной, и снег таял на облезшей кошке, послужившей материалом для воротника. — Кто привез письмо? — А не знаю я. С бородой. Кооператор он. В город ехал, говорит. — Гм... ну ступайте. Нет, постойте. Вот я сейчас записку напишу главному врачу, отнесите, пожалуйста, и ответ мне верните. — Хорошо. Моя записка главному врачу:

«13 февраля 1918 года. Уважаемый Павел Илларионович. Я сейчас получил письмо от моего товарища по университету доктора Полякова. Он сидит на Гореловском моем бывшем участке в полном одиночестве."
