,Author Name,Author,Content
0,Андреев,0," ﻿I

Он сильно пил, потерял работу и знакомых и поселился в подвале вместе с ворами и проститутками, проживая последние вещи. У него было больное, бескровное тело, изношенное в работе, изъеденное страданиями и водкой, и смерть уже сторожила его, как хищная серая птица, слепая при солнечном свете и зоркая в черные ночи. Днем она пряталась в темных углах, а ночью бесшумно усаживалась у его изголовья и сидела долго, до самого рассвета, и была спокойна, терпелива и настойчива. Когда при первых проблесках дня он высовывал из-под одеяла бледную голову с глазами травимого зверя, в комнатке было уже пусто, — но он не верил этой обманчивой пустоте, которой верят другие. Он подозрительно оглядывал углы, с хитрой внезапностью бросал взгляд за спину и потом, опершись на локти, внимательно и долго смотрел перед собой в тающую тьму уходящей ночи. И тогда он видел то, чего никогда не видят другие: колыхание серого огромного тела, бесформенного и страшного. Оно было прозрачно, охватывало все, и предметы в нем были как за стеклянной стеной. Но теперь он не боялся его, и, оставляя холодный след, оно уходило — до следующей ночи. На короткое время он забывался, и сны приходили к нему страшные и необыкновенные. Он видел белую комнату, с белым полом и стенами, освещенную белым ярким светом, и черную змею, которая выползала из-под двери с легким шуршанием, похожим на смех. Прижав к полу острую, плоскую голову и извиваясь, она быстро выскальзывала, куда-то пропадала, и опять в отверстии под дверью показывался ее приплюснутый черный нос, и черной лентой вытягивалось тело, — и опять и опять. Раз он увидел во сне что-то веселое и засмеялся, но звук получился странный, похожий на подавленное рыдание, и было страшно его слушать: где-то в безвестной глубине смеется, не то плачет душа, в то время когда тело неподвижно, как у мертвого. Постепенно в его сознание начинали входить звуки рождающегося дня: глухой говор прохожих, отдаленный скрип двери, громыхание дворницкой метлы, сметающей снег с подоконника, — весь неопределенный гул просыпающегося большого города. И тогда наступало для него самое ужасное: беспощадно светлое сознание, что пришел новый день и скоро ему нужно вставать, чтобы бороться за жизнь без надежды на победу. Нужно жить. Он поворачивался спиной к свету, набрасывал на голову одеяло, чтобы ни малейший луч не мог проникнуть в его глаза, сжимался в маленький комок, подтягивая ноги к самому подбородку, и так лежал неподвижно, боясь пошевелиться и протянуть ноги. Целой горой лежала на нем одежда, которою он укрывался от подвальной стужи, но он не чувствовал ее тяжести, и тело его было холодно. И при каждом звуке, говорившем о жизни, он казался себе огромным и открытым, сжимался еще больше и беззвучно стонал — не голосом и не мыслью, так как теперь он боялся собственного голоса и собственных мыслей. Он молился кому-то, чтобы день не приходил и ему всегда можно было лежать под грудой тряпья, не шевелясь и не мысля, и напрягал всю волю, чтобы удержать идущий день и уверить себя, что ночь еще продолжается, И больше всего в мире ему хотелось, чтобы кто-нибудь сзади приложил револьвер к затылку, к тому месту, где чувствуется углубление, и выстрелил. А день развертывался — широкий, неудержимый, властно зовущий к жизни, и весь мир начинал двигаться, говорить, работать и думать. В подвале первой просыпалась хозяйка, старуха Матрена, имевшая двадцатипятилетнего любовника, и начинала топать по кухне, стучать ведрами и возиться над чем-то у самых дверей Хижнякова. Он чувствовал ее приближение и замирал, решаясь не отзываться, если она его позовет. Но она молчала и куда-то уходила, а потом часа через два просыпались двое других жильцов: гулящая девушка Дуняша и любовник старухи, Абрам Петрович. Так почтительно, несмотря на молодость, звали его все, потому что он был смелый и искусный вор и еще что-то, о чем только подозревали, но не решались говорить. Их пробуждения больше всего страшился Хижняков, так как оба они имели на него право, могли войти, сесть на кровать, трогать его руками и вызывать его на мысли и разговоры. С Дуняшей он как-то сошелся, пьяный, и обещал на ней жениться, и хотя она смеялась и хлопала его по плечу, но искренно считала его влюбленным в себя и покровительствовала, а сама была глупая, грязная, дурно пахнущая и часто ночевала в участке. А с Абрамом Петровичем он только третьего дня вместе пьянствовал, целовался и давал клятвы в вечной дружбе. Когда раздался свежий и громкий голос Абрама Петровича и его быстрые шаги мимо двери, Хижняков застыл от страха и ожидания, простонал, не сдержавшись, вслух и еще более испугался. В одной яркой картине перед ним пронеслось его пьянство, как они сидели в каком-то темном трактире, освещенном одной лампой, среди темных, шепчущихся почему-то людей, и тоже шептались. Абрам Петрович, бледный и возбужденный, жаловался на трудную жизнь вора, зачем-то обнажал руку и давал щупать неправильно сросшиеся кости, а Хижняков целовал его и говорил:

— Я люблю воров. Они смелые, — и предлагал ему выпить на брудершафт, хотя они давно говорили на ты. — А я люблю тебя, что ты образованный и понимаешь нашего брата, — отвечал Абрам Петрович. — Гляди-ка, рука-то: она вот! И опять перед его глазами протягивалась белая рука, казавшаяся жалкой от своей белизны, и в внезапном понимании чего-то, чего он теперь не помнил и не понимал, он целовал эту руку, а Абрам Петрович горделиво кричал:

— Верно, брат! Помрем, а не сдадимся! А потом что-то грязное, кружащееся, вой, свист и прыгающие огни. И тогда это было весело, а теперь, когда в углах пряталась смерть и отовсюду надвигался день с необходимостью жить, и действовать, и за что-то бороться, о чем-то просить, — было мучительно и непередаваемо ужасно. — Барин, спишь? — насмешливо спросил за дверью Абрам Петрович и, не получив ответа, добавил: — Ну спи, черт с тобой. К Абраму Петровичу приходит много знакомых, и в течение целого дня визжит дверь и раздаются басистые голоса. И Хижнякову при каждом стуке кажется, что это пришли к нему и за ним, и он прячется все глубже и долго прислушивается, пока поймет, кому принадлежит голос. Он ждет, ждет мучительно, с содроганием всего тела, хотя нет во всем мире никого, кто пришел бы к нему и за ним. У него была жена когда-то, давно, и умерла. Еще дальше в прошлом у него были братья и сестры, а еще дальше — нечто смутное и красивое, что он называл матерью. И все они умерли, а может быть, кто-нибудь и жив, но так затерян в бесконечном мире, как будто бы умер. И он скоро умрет, — он это знает. Когда он встанет сегодня с своего ложа, у него будут подламываться и трястись ноги, а руки будут делать неверные, странные движения, — и это смерть. Но, пока она придет, нужно жить, и это такая грозная задача для человека, у которого нет денег, здоровья и воли, что Хижнякова охватывает отчаяние. Он сбрасывает с себя одеяло, заламывает руки и бросает в пространство такие долгие стоны, как будто сквозь тысячи страдающих грудей прошли они и оттого стали такими полными, до краев налитыми нестерпимой мукой. — Отопри, черт! — кричит за дверью Дуняша и колотит в дверь кулаком. — А то ведь дверь сломаю! Трясясь и качаясь, Хижняков подошел к двери, открыл ее и быстро, почти падая, снова улегся в постель. Дуняша, уже завитая и напудренная, села рядом с ним, притиснув его к стене, положила ногу на ногу и важно сказала:

— А я тебе новость принесла. Катя вчера Богу душу отдала. — Какая Катя? — спросил Хижняков. И язык у него ворочался тяжело и неверно, как чужой. — Ну вот, забыл, — засмеялась Дуняша. — Такая Катя, которая у нас жила. Как же ты забыл, когда она всего неделю ушла. — Умерла? — Ну да, умерла, как все помирают. Дуняша послюнявила короткий палец и отерла пудру с редких ресниц. — От чего? — От того, от чего все помирают. Кто же ее знает, от чего. Мне вчера в кофейной сказали. Умерла, говорят, Катя. — А ты ее любила? — Конечно, любила. О чем спрашивает! Глупые глаза Дуняши смотрели на Хижнякова с тупым равнодушием, и толстая нога покачивалась. Она не знала, о чем ей больше говорить, и старалась смотреть на лежащего так, чтобы показать ему свою любовь, и для этого слегка прищурила один глаз и опустила углы толстых губ. День начался. II

В этот день, в субботу, мороз был такой сильный, что гимназисты не ходили учиться и конские бега были перенесены на другой день, так как представлялась опасность простудить лошадей. Когда Наталья Владимировна вышла из родильного приюта, она в первую минуту была рада, что уже вечер, что на набережной никого нет и никто не встретит ее, девушку, с шестидневным ребенком на руках."
