,Author Name,Author,Content
18,Бунин,3," ﻿I

То, что так долго всех волновало и тревожило, наконец разрешилось: Великий Перевоз сразу опустел наполовину. Много белых и голубых хат осиротело в этот летний вечер. Много народу навек покинуло родимое село – его зеленые переулки между садами, пыльный базарный выгон, где так весело в солнечное воскресное утро, когда кругом стоит говор, гудит бранью и спорами корчма, выкрикивают торговки, поют нищие, пиликает скрипка, меланхолично жужжит лира, а важные волы, прикрывая от солнца глаза, сонно жуют сено под эти нестройные звуки; покинуло разноцветные огороды и густые верболозы с матово-бледной длинной листвой над криницею, при спуске к затону реки, где в тихие вечера в воде что-то стонет глухо и однотонно, словно дует в пустую бочку; навсегда покинуло родину для далеких уссурийских земель и ушло «на край света»…

Когда на село, расположенное в долине, легла широкая прохладная тень от горы, закрывающей запад, а в долине, к горизонту, все зарумянилось отблеском заката, зарделись рощи, вспыхнули алым глянцем изгибы реки, и за рекой как золото засверкали равнины песков, народ, пестреющий яркими, праздничными нарядами, собрался на зеленую леваду, к белой старинной церковке, где молились еще казаки и чумаки перед своими далекими походами. Там, под открытым небом, между нагруженных телег, начался молебен, и в толпе воцарилась мертвая тишина. Голос священника звучал внятно и раздельно, и каждое слово молитвы проникало до глубины каждого сердца…

Много слез упало на этом месте и в былые дни. Стояли здесь когда-то снаряженные в далекий путь «лыцари». Они тоже прощались, как перед кончиной, и с детьми и с женами, и не в одном сердце заранее звучала тогда величаво-грустная «дума» о том, «як на Черному морi, на бiлому каменi сидить ясен сокiл-бiлозiрець, жалiбненько квилить-проквиляї…». Многих из них ожидали «кайдани турецькiї, каторга бусурманськая», и «сивi тумани» в дороге, и одинокая смерть под степным курганом, и стаи орлов сизокрылых, что будут «на чорнi кудрi наступати, з лоба очi козацькiє видирати…». Но тогда надо всем витала гордая казацкая воля. А теперь стоит серая толпа, которую навсегда выгоняет на край света не прихоть казацкая, а нищета, эти желтые пески, что сверкают за рекою. И как на великой панихиде, заказанной по самом себе, тихо стоял народ на молебне с поникшими, обнаженными головами. Только ласточки звонко щебетали над ними, проносясь и утопая в вечернем воздухе, в голубом глубоком небе…

А потом поднялись вопли. И среди гортанного говора, плача и криков двинулся обоз по дороге в гору. В последний раз показался Великий Перевоз в родной долине – и скрылся… И сам обоз скрылся наконец за хлебами, в полях, в блеске низкого вечернего солнца…



II

Провожавшие возвращались домой. Народ толпами валил под гору, к хатам. Были и такие, что только вздохнули и пошли домой торопливо и беспечно. Но таких было мало. Молча, покорно согнувшись, шли старики и старухи; хмурились суровые хозяйственные мужики; плакали дети, которых тащили за маленькие ручки отцы и матери; громко кричали молодые бабы и дивчата. Вот две спускаются под гору, по каменистой дороге. Одна, крепкая, невысокая, хмурит брови и рассеянно смотрит своими черными серьезными глазами куда-то вдаль, по долине. Другая, высокая, худенькая, плачет… Обе наряжены по-праздничному, но как горько плачет одна, прижимая к глазам рукав сорочки! Спотыкаются сафьяновые сапоги, на которые так красиво падает из-под плахты белоснежный подол… Звонко, с неудержимой радостью пела она до глубокой ночи, бегая на реку с ведрами, когда отец Юхыма твердо сказал, что не пойдет на новые места! А потом…

– Прокинулись сю нiч, – говорил Юхым растерянно, – прокинулись вони, Зинька, та й кажуть: «Їдемо на переселения!» – «Як же так, тату, вы ж казали…» – «Hi, кажуть, я сон бачив…»

А вот на горе, около мельниц, стоит в толпе стариков старый Василь Шкуть. Он высок, широкоплеч и сутул. От всей фигуры его еще веет степной мощью, но какое у него скорбное лицо! Ему вот-вот собираться в могилу, а он уже никогда больше не услышит родного слова и помрет в чужой хате, и некому будет ему глаза закрыть. Перед смертью оторвали его от семьи, от детей и внучат. Он бы дошел, он еще крепок, но где же взять эти семьдесят рублей, которых не хватило для разрешения идти на новые земли? Старики, рассеянно переговариваясь, каждый со своей думой, стоят на горе. Они все глядят в ту сторону, куда отбыли земляки. Уже давно не стало видно и последней телеги. Опустела степь. Весело и кротко распевают, сыплют трели жаворонки. Мирно и спокойно догорает ясный день. Привольно зеленеют кругом хлеба и травы, далеко-далеко темнеют курганы; а за курганами необъятным полукругом простерся горизонт, между землей и небом охватывает степь полоса голубоватой воздушной бездны, как полоса далекого моря. «Що воно таке, сей Уссурiйський край?» – думают старики, прикрывая глаза от солнца, и напрягают воображение представить себе эту сказочную страну на конце света и то громадное пространство, что залегает между ней и Великим Перевозом, мысленно увидать, как тянется длинный обоз, нагруженный добром, бабами и детьми, медленно скрипят колеса, бегут собаки и шагают за обозом по мягкой пыльной дороге, пригретой догорающим солнцем, «дядьки» в широких шароварах. Небось и они все глядят в эту загадочную голубоватую даль:

«Що воно таке, сей Уссурiйський край?»

А старый Шкуть, опершись на палку, надвинув на лоб шапку, представляет себе воз сына и с покорной улыбкой бормочет:

– Я йому, бачите, и пилу и фуганок дав… и як хату строїть, вiн тепер знаї… Не пропаде! – Багато людей загинуло! – говорят, не слушая его, другие. – Багато, багато! III

Темнеет – и странная тишина царит в селе. Теплые южные сумерки неясной дымкой смягчают вечернюю синеву глубокой долины, затушевывают эту огромную картину широкой низменности с темными кущами прибрежных рощ, с тускло блестящими изгибами речки, с одинокими тополями, что чернеют над долиной. Старинный Великий Перевоз сереет своими скученными хатами в котловине у подошвы каменистой горы. Смутно, как полосы спелых ржей, желтеют за рекой пески. За песками, уже совсем неясно, темнеют леса. И даль становится дымчато-лиловой и сливается с сумеречными небесами. Все, как всегда, бывало в этой мирной долине в летние сумерки… Но нет, не все! Много стоит хат темных, забитых и немых…

Уже почти все разбрелись по домам. Пустеет дорога. Медленно бредет по ней несколько человек, провожавших переселенцев до ближнего перекрестка. Они чувствуют ту внезапную пустоту в сердце и непонятную тишину вокруг себя, которая всегда охватывает человека после тревоги проводов, при возвращении в опустевший дом. Спускаясь под гору, они глядят на село другими глазами, чем прежде, – точно после долгой отлучки…

Вот расстилается пахучий дымок над чьей-то хатой… покойно и буднично…

Вот красной звездочкой, среди темных садов, среди скученных дворов, загорелся огонек…

Глядя на огоньки и в долину, медленно расходятся старики, и на горе, близ дороги, остаются одни темные ветряки с неподвижно распростертыми крыльями. Молча идет под гору, улыбаясь своей странной улыбкой старческого горя, Василь Шкуть. Медленно отложил он калитку, медленно прошел через дворик и скрылся в хате. Хата родная. Но Шкуть в ней больше не хозяин. Ее купили чужие люди и позволили ему только «дожить» в ней. Это надо сделать поскорее…

В теплом и душном мраке хаты выжидательно трюкает сверчок из-за печки… словно прислушивается… Сонные мухи гудят по потолку… Старик, согнувшись, сидит в темноте и безмолвии. Что-то он думает? Может быть, про то, как где-то там, по смутно белеющей дороге, тихо поскрипывает обоз? – Э, да что про то и думать! Звонкий девический голос замирает за рекою:

		Ой, зiйди, зiйди,
		Ясен мiсяцю! Глубокое молчание. Южное ночное небо в крупных жемчужных звездах. Темный силуэт неподвижного тополя рисуется на фоне ночного неба. Под ним чернеет крыша, белеют стены хаты. Звезды сияют сквозь листья и ветви…



IV

А они еще недалеко. Они ночуют в степи, под родным небом, но им уже кажется, что они за тысячу верст ото всего привычного, родного. Как цыганский табор, расположились они у дороги. Распрягли лошадей, сварили ужин; то вели беспокойные разговоры, то угрюмо молчали и сторонились друг друга…

Наконец все стихло. В звездном свете темнели беспорядочно скученные возы, виднелись фигуры лежащих людей и наклоненных к траве лошадей. Сторожевые, с кнутами в руках, сонно ежились возле телег, зевали и с тоской глядели в темную степь…

Но с какой радостью встрепенулись они, когда услыхали скрип проезжей телеги! Земляк! Они окружили его, улыбались и жали ему руку, словно не видались много-много лет. Разбуженные говором, подымались с земли и другие и, застенчиво скрывая свою радость, тоже толпились у телеги проезжего, закуривали трубки и были готовы говорить хоть до самого света…

Потом опять все затихло. Взволнованные встречей, засыпали они, закрывая головы свитками, и все думали об одном, – о далекой неизвестной стране на краю света, о дорогах и больших реках в пути, о родном покинутом селе…

Холоднело."
